{"schemaVersion":1,"contractVersion":1,"presentation":{"background":{"outerColour":{"red":0.012,"green":0.014,"blue":0.018},"centreColour":{"red":0.14,"green":0.16,"blue":0.2},"centreX":0.5,"centreY":0.58,"radius":0.7,"horizontalScale":0.82},"lighting":{"keyLight":{"yawDegrees":-32,"pitchDegrees":42,"intensity":1.15,"colour":{"red":1,"green":0.94,"blue":0.84}},"fillLight":{"yawDegrees":145,"pitchDegrees":25,"intensity":0.55,"colour":{"red":0.62,"green":0.75,"blue":1}}}},"navigation":{"minimumPitchDegrees":-80,"maximumPitchDegrees":80,"minimumDistanceMultiplier":0.75,"maximumDistanceMultiplier":50,"pointerOrbitDegreesPerUnit":0.22,"keyboardOrbitStepDegrees":5,"pointerZoomStep":0.16,"keyboardZoomStep":0.14},"lightControls":{"minimumPitchDegrees":-80,"maximumPitchDegrees":80,"pointerStepDegrees":1,"keyboardStepDegrees":5},"overlay":{"initiallyVisible":true,"restoreControlId":"show-controls"},"itemSelection":{"wrapPreviousNext":true,"initiallyShowAll":true},"animationTransport":{"selectFirstAnimation":true,"initiallyPlaying":false,"keyboardScrubSeconds":0.1},"bindings":[{"action":"OrbitPointer","input":"pointer-primary-drag"},{"action":"OrbitUp","input":"arrow-up"},{"action":"OrbitDown","input":"arrow-down"},{"action":"OrbitLeft","input":"arrow-left"},{"action":"OrbitRight","input":"arrow-right"},{"action":"ZoomPointer","input":"pointer-wheel"},{"action":"ZoomIn","input":"equals"},{"action":"ZoomIn","input":"numpad-plus"},{"action":"ZoomIn","input":"page-up"},{"action":"ZoomOut","input":"minus"},{"action":"ZoomOut","input":"numpad-minus"},{"action":"ZoomOut","input":"page-down"},{"action":"ResetView","input":"r"},{"action":"LightDirectionPointer","input":"focused-slider-pointer"},{"action":"LightUp","input":"focused-light-arrow-up"},{"action":"LightDown","input":"focused-light-arrow-down"},{"action":"LightLeft","input":"focused-light-arrow-left"},{"action":"LightRight","input":"focused-light-arrow-right"},{"action":"ResetLight","input":"l"},{"action":"ToggleOverlay","input":"h"},{"action":"FocusNext","input":"tab"},{"action":"FocusPrevious","input":"shift-tab"},{"action":"ActivateFocusedControl","input":"enter"},{"action":"ActivateFocusedControl","input":"space"},{"action":"ItemPrevious","input":"focused-previous-enter-or-space"},{"action":"ItemNext","input":"focused-next-enter-or-space"},{"action":"ItemDirect","input":"focused-item-selector"},{"action":"ItemAll","input":"focused-all-items-enter-or-space"},{"action":"AnimationSelect","input":"focused-animation-selector"},{"action":"AnimationPlayPause","input":"focused-play-pause-enter-or-space"},{"action":"AnimationReplay","input":"focused-replay-enter-or-space"},{"action":"AnimationScrub","input":"focused-timeline-arrows-or-pointer"},{"action":"AnimationLoop","input":"focused-loop-enter-or-space"}],"accessibility":{"visibleFocusRequired":true,"controls":[{"id":"reset-view","label":"Reset View","accessibleName":"Reset preview view","accessibleHelp":"Restore the default camera orbit and zoom.","focusOrder":0},{"id":"light-direction","label":"Light Direction","accessibleName":"Adjust key light direction","accessibleHelp":"Change the key-light yaw and pitch without changing intensity.","focusOrder":1},{"id":"reset-light","label":"Reset Light","accessibleName":"Reset key light","accessibleHelp":"Restore the approved studio key-light direction.","focusOrder":2},{"id":"item-previous","label":"Previous","accessibleName":"Previous preview item","accessibleHelp":"Show the previous item in deterministic order.","focusOrder":3},{"id":"item-next","label":"Next","accessibleName":"Next preview item","accessibleHelp":"Show the next item in deterministic order.","focusOrder":4},{"id":"item-select","label":"Item","accessibleName":"Select preview item","accessibleHelp":"Choose one item directly or show all items.","focusOrder":5},{"id":"animation-select","label":"Animation","accessibleName":"Select animation","accessibleHelp":"Choose an animation clip without changing its source asset.","focusOrder":6},{"id":"animation-play-pause","label":"Play","accessibleName":"Play or pause animation","accessibleHelp":"Play, pause, or resume the selected animation.","focusOrder":7},{"id":"animation-replay","label":"Replay","accessibleName":"Replay animation","accessibleHelp":"Restart the selected animation from zero.","focusOrder":8},{"id":"animation-timeline","label":"Timeline","accessibleName":"Animation timeline","accessibleHelp":"Scrub within the selected animation duration.","focusOrder":9},{"id":"animation-loop","label":"Loop","accessibleName":"Loop animation preview","accessibleHelp":"Toggle preview looping without changing source clip import settings.","focusOrder":10},{"id":"hide-controls","label":"Hide Controls","accessibleName":"Hide preview controls","accessibleHelp":"Hide the overlay for an unobstructed capture.","focusOrder":11},{"id":"show-controls","label":"Show Controls","accessibleName":"Show preview controls","accessibleHelp":"Restore the hidden preview controls.","focusOrder":12}]}}